{
  "policyKind": "month_close",
  "version": 1,
  "effectiveFrom": "1970-01-01T00:00:00Z",
  "effectiveTo": null,
  "scope": { "tenantId": "00000000-0000-0000-0000-000000000000", "siteId": null, "unitId": null },
  "notes": "Seed default recorded 2026-10-15 from the SME R1 / R4 pilot settings for an Iranian plant (other plants: gregorian months, weekend [6, 7]). scope.tenantId is a placeholder that the seeder replaces with the real tenant id; effectiveFrom is the epoch sentinel.",
  "body": {
    "financialCalendar": "persian",
    "weekendDays": [4, 5],
    "quantitiesCloseWorkingDay": 3,
    "financeSignOffWorkingDay": 5,
    "blockOnOpenProposals": true,
    "materiality": { "enabled": false, "thresholds": {}, "reviewerRoles": ["production_accountant"] }
  }
}
